ID,createdAt,modifiedAt,name,description
34a8e126-5e2f-4093-ad42-e628865ef01b,2024-01-01,2024-01-01,Equipment,"Cameras, lighting, and related gear"
1b92d34e-8883-4728-8583-d82696d477bb,2024-01-02,2024-01-02,Props,Props and decorations for the set
8f08b5af-bf69-450a-8a42-28f3d6ff24ab,2024-01-03,2024-01-03,Location,Costs for location rentals
7fae6e07-dd93-4a1e-8c22-3e0be00e567c,2024-01-04,2024-01-04,Marketing,Advertising and promotional expenses
103631e7-2673-445d-a227-3a7c37217903,2024-01-05,2024-01-05,Post Production,"Editing, sound, and special effects"
